"id","label","comment","subPropertyOf","equivalentProperty","subproperties","domainIncludes","rangeIncludes","inverseOf","supersedes","supersededBy","isPartOf"
"http://schema.org/skills","skills","Skills required to fulfill this role., Skills required to fulfill this role or in this Occupation.","","","","http://schema.org/JobPosting, http://schema.org/Occupation","http://schema.org/Text","","",""
"http://schema.org/speakable","speakable","Indicates sections of a Web page that are particularly 'speakable' in the sense of being highlighted as being especially appropriate for text-to-speech conversion. Other sections of a page may also be usefully spoken in particular circumstances; the 'speakable' property serves to indicate the parts most likely to be generally useful for speech.<br/><br/>

The <em>speakable</em> property can be repeated an arbitrary number of times, with three kinds of possible 'content-locator' values:<br/><br/>

1.) <em>id-value</em> URL references - uses <em>id-value</em> of an element in the page being annotated. The simplest use of <em>speakable</em> has (potentially relative) URL values, referencing identified sections of the document concerned.<br/><br/>

2.) CSS Selectors - addresses content in the annotated page, eg. via class attribute. Use the <a class=""localLink"" href=""http://schema.org/cssSelector"">cssSelector</a> property.<br/><br/>

3.)  XPaths - addresses content via XPaths (assuming an XML view of the content). Use the <a class=""localLink"" href=""http://schema.org/xpath"">xpath</a> property.<br/><br/>

For more sophisticated markup of speakable sections beyond simple ID references, either CSS selectors or XPath expressions to pick out document section(s) as speakable. For this
we define a supporting type, <a class=""localLink"" href=""http://schema.org/SpeakableSpecification"">SpeakableSpecification</a>  which is defined to be a possible value of the <em>speakable</em> property.","","","","http://schema.org/Article, http://schema.org/WebPage","http://schema.org/SpeakableSpecification, http://schema.org/URL","","",""
"http://schema.org/spokenByCharacter","spokenByCharacter","The (e.g. fictional) character, Person or Organization to whom the quotation is attributed within the containing CreativeWork.","","","","http://schema.org/Quotation","http://schema.org/Organization, http://schema.org/Person","","",""
"http://schema.org/subjectOf","subjectOf","A CreativeWork or Event about this Thing..","","","","http://schema.org/Thing","http://schema.org/CreativeWork, http://schema.org/Event","http://schema.org/about","",""
"http://schema.org/termCode","termCode","A code that identifies this <a class=""localLink"" href=""http://schema.org/DefinedTerm"">DefinedTerm</a> within a <a class=""localLink"" href=""http://schema.org/DefinedTermSet"">DefinedTermSet</a>","","","http://schema.org/codeValue","http://schema.org/DefinedTerm","http://schema.org/Text","","",""
"http://schema.org/termsOfService","termsOfService","Human-readable terms of service documentation.","","","","http://schema.org/Service","http://schema.org/Text, http://schema.org/URL","","",""
"http://schema.org/touristType","touristType","Attraction suitable for type(s) of tourist. eg. Children, visitors from a particular country, etc.","","","","http://schema.org/TouristAttraction, http://schema.org/TouristDestination, http://schema.org/TouristTrip","http://schema.org/Audience, http://schema.org/Text","","",""
"http://schema.org/unnamedSourcesPolicy","unnamedSourcesPolicy","For an <a class=""localLink"" href=""http://schema.org/Organization"">Organization</a> (typically a <a class=""localLink"" href=""http://schema.org/NewsMediaOrganization"">NewsMediaOrganization</a>), a statement about policy on use of unnamed sources and the decision process required.","http://schema.org/publishingPrinciples","","","http://schema.org/NewsMediaOrganization, http://schema.org/Organization","http://schema.org/CreativeWork, http://schema.org/URL","","",""
"http://schema.org/usesHealthPlanIdStandard","usesHealthPlanIdStandard","The standard for interpreting thePlan ID. The preferred is ""HIOS"". See the Centers for Medicare &amp; Medicaid Services for more details.","","","","http://schema.org/HealthInsurancePlan","http://schema.org/Text, http://schema.org/URL","","",""
"http://schema.org/variableMeasured","variableMeasured","The variableMeasured property can indicate (repeated as necessary) the  variables that are measured in some dataset, either described as text or as pairs of identifier and description using PropertyValue.","","","","http://schema.org/Dataset","http://schema.org/PropertyValue, http://schema.org/Text","","",""
"http://schema.org/verificationFactCheckingPolicy","verificationFactCheckingPolicy","Disclosure about verification and fact-checking processes for a <a class=""localLink"" href=""http://schema.org/NewsMediaOrganization"">NewsMediaOrganization</a> or other fact-checking <a class=""localLink"" href=""http://schema.org/Organization"">Organization</a>.","http://schema.org/publishingPrinciples","","","http://schema.org/NewsMediaOrganization","http://schema.org/CreativeWork, http://schema.org/URL","","",""
"http://schema.org/xpath","xpath","An XPath, e.g. of a <a class=""localLink"" href=""http://schema.org/SpeakableSpecification"">SpeakableSpecification</a> or <a class=""localLink"" href=""http://schema.org/WebPageElement"">WebPageElement</a>. In the latter case, multiple matches within a page can constitute a single conceptual ""Web page element"".","","","","http://schema.org/SpeakableSpecification, http://schema.org/WebPageElement","http://schema.org/XPathType","","",""
