"id","label","comment","enumerationtype","supersedes","supersededBy","isPartOf"
"http://schema.org/AuthoritativeLegalValue","AuthoritativeLegalValue","Indicates that the publisher gives some special status to the publication of the document. (""The Queens Printer"" version of a UK Act of Parliament, or the PDF version of a Directive published by the EU Office of Publications). Something ""AuthoritativeLegalValue"" is considered to be also <a class=""localLink"" href=""http://schema.org/OfficialLegalValue"">OfficialLegalValue</a>"".","http://schema.org/LegalValueLevel","","","http://pending.schema.org"
"http://schema.org/Definitive","Definitive","Indicates a document for which the text is conclusively what the law says and is legally binding. (e.g. The digitally signed version of an Official Journal.)
  Something ""Definitive"" is considered to be also ""<a href=""/Authoritative"">Authoritative</a>"".","http://schema.org/LegalValueLevel","","","http://pending.schema.org"
"http://schema.org/InForce","InForce","Indicates that a legislation is in force.","http://schema.org/LegalForceStatus","","","http://pending.schema.org"
"http://schema.org/NotInForce","NotInForce","Indicates that a legislation is currently not in force.","http://schema.org/LegalForceStatus","","","http://pending.schema.org"
"http://schema.org/OfficialLegalValue","OfficialLegalValue","All the documents published by an official publisher should have at least the legal value level ""OfficialLegalValue"". This indicates that the document was published by an organisation with the public task of making it available (e.g. a consolidated version of a EU directive published by the EU Office of Publications).","http://schema.org/LegalValueLevel","","","http://pending.schema.org"
"http://schema.org/PartiallyInForce","PartiallyInForce","Indicates that parts of the legislation are in force, and parts are not.","http://schema.org/LegalForceStatus","","","http://pending.schema.org"
"http://schema.org/UnofficialLegalValue","UnofficialLegalValue","Indicates that a document has no particular or special standing (e.g. a republication of a law by a private publisher).","http://schema.org/LegalValueLevel","","","http://pending.schema.org"
